Titulo,Fecha,URL,Contenido
"‘Serious escalation’: World reacts to Iran’s drone, missile raids on Israel",2024-04-14,https://www.aljazeera.com/news/2024/4/14/serious-escalation-world-reacts-to-irans-drone-missile-raids-on-israel,"‘Serious escalation’: World reacts to Iran’s drone, missile raids on Israel | News | Al Jazeera






















Skip linksSkip to Contentplay Live Show navigation menuNavigation menuNewsShow more news sectionsMiddle EastAfricaAsiaUS & CanadaLatin AmericaEuropeAsia PacificIsrael War on GazaFeaturesOpinionVideoMoreShow more sectionsEconomyUkraine warCoronavirusClimate CrisisInvestigationsInteractivesIn PicturesScience & TechnologySportPodcastsplay Live Click here to searchsearchNews‘Serious escalation’: World reacts to Iran’s drone, missile raids on IsraelWorld leaders express fear the conflict could lead to further escalation in the region, calling for all sides to exercise restraint.Objects are seen in the sky above Jerusalem after Iran launched drones and missiles towards Israel [Ronen Zvulun/Reuters]Published On 14 Apr 202414 Apr 2024|Updated: 14 Apr 202404:24 PM (GMT)The international community has reacted with alarm after Iran launched explosive drones and fired missiles at Israel in its first direct attack on Israeli territory.
Tehran had been threatening to attack Israel after an air raid on April 1, widely blamed on Israel, destroyed Iran’s consulate in Syria, killing 13 people, including two elite Iranian generals.Keep reading list of 4 itemslist 1 of 4Iran launches hundreds of missiles, drones in first direct attack on Israellist 2 of 4Biden vows G7 response, ‘ironclad’ US support for Israel after Iran attackslist 3 of 4Several countries issue travel warnings over Israel-Iran tensionslist 4 of 4‘Disastrous’: Israel-Iran tensions test limits of US policy amid Gaza warend of list
The Israeli forces said in a statement early on Sunday the “vast majority” of missiles launched from Iran were intercepted outside of Israel’s borders.
Tensions between Israel and Iran have soared since Israel’s six-month war in the Gaza Strip.
Here is how the world reacted to Iran’s retaliatory attacks on Israel:
Argentina
The office of President Javier Milei expressed its “solidarity and unwavering commitment” to Israel in the face of the attacks.
It added that Argentina “emphatically supports the State of Israel in the defence of its sovereignty, especially against regimes that promote terror”, noting an Argentinian court recently held Iran responsible for bomb attacks on the Israeli embassy and a Jewish community centre in Buenos Aires in the 1990s.
Iranian demonstrators react after the IRGC attack on Israel during an anti-Israeli gathering in front of the British embassy in Tehran [Majid Asgaripour/West Asia News Agency via Reuters]
Brazil
The Ministry of Foreign Affairs issued a statement saying it follows “with grave preoccupation” the news that Iranian drones and missiles were sent to Israel.
It noted that Brazil has been warning the international community, since the beginning of the war on Gaza that the conflict could spread throughout the region.
Canada
Canadian Prime Minister Justin Trudeau told reporters in Ottawa that his country “unequivocally condemns Iran’s airborne attacks”, adding: “We stand with Israel.”
“After supporting Hamas’s brutal October 7 attack, the Iranian regime’s latest actions will further destabilise the region and make lasting peace more difficult,” he added.
China
China is deeply concerned about escalation after Iran’s attacks, a Ministry of Foreign Affairs spokesperson said in remarks published on its website.
“China calls on relevant parties to remain calm and exercise restraint to avoid further escalation of tensions,” the spokesperson said in response to a question about Iran’s strikes.
This round of tensions is a “spillover from the Gaza conflict”, and quelling that conflict is “a top priority”, the spokesperson added.
Colombia
President Gustavo Petro called the attacks “predictable”, adding that “we’re now in the prelude to World War III precisely when humanity should rebuild its economy towards the rapid goal of decarbonisation”.
“The support of the US, in practice, for a genocide, has ignited the world. Everyone knows how wars start, no one knows how they end. If only the people of Israel were high enough, like their ancestors, to stop the madness of their ruler,” he said in a statement.
“The United Nations must meet urgently and must immediately commit to peace.”
Egypt
The Ministry of Foreign Affairs expressed its “deep concern” at the escalation of hostilities and called for “maximum restraint”.
Its statement also warned of the “risk of the regional expansion of the conflict”, and added that Egypt would be “in direct contact with all parties to the conflict to try and contain the situation”.
European Union
“The EU strongly condemns the unacceptable Iranian attack against Israel,” EU’s top diplomat Josep Borrell said in a post on X.
“This is an unprecedented escalation and a grave threat to regional security.”

The EU strongly condemns the unacceptable Iranian attack against Israel.
This is an unprecedented escalation and a grave threat to regional security.
— Josep Borrell Fontelles (@JosepBorrellF) April 13, 2024

France
Foreign Minister Stephane Sejourne said Iran is taking a “new step in its destabilising actions and taking the risk of a military escalation”.
Germany
German Chancellor Olaf Scholz said that his country would do everything possible to prevent further escalation in the Middle East.
“We can only warn Iran in particular. It is good that Israel, together with its partners, has largely repelled this attack,” he said in a statement on the social media platform X.
German Foreign Minister Annalena Baerbock condemned the attack which she said “could plunge an entire region into chaos.
Iran and its proxies must stop this immediately,” she said. “Israel offers our full solidarity at this time,” she added.
G7
After a video conference held by the Group of Seven (G7) leaders, the president of the European Council, Charles Michel, said the group “unanimously condemned” the drone and missile attack, but added that “all parties must exercise restraint”.
“We will continue all our efforts to work towards de-escalation. Ending the crisis in Gaza as soon as possible, notably through an immediate ceasefire, will make a difference,” Michel added.
 
 



 
India
India said it was “seriously concerned at the escalation of hostilities between Israel and Iran, which threatens the peace and security in the region”.
“We call for immediate de-escalation, exercise of restraint, stepping back from violence and return to the path of diplomacy,” the Ministry of External Affairs said in a statement.
India, it added, is closely monitoring the evolving situation and Indian embassies in the region are in close touch with the Indian community.
“It is vital that security and stability are maintained in the region,” the statement further said.
Jordan
Prime Minister Bisher Khasawneh said any escalation in the region would lead to “dangerous paths” and said that there was a need to reduce escalation by all parties.
In remarks to the cabinet, Khasawneh said the country’s armed forces would confront any attempt by any party that sought to endanger the kingdom’s security.
Lebanon
Lebanese group Hezbollah praised Iran’s attack on Israel, describing it as a “brave” decision.
Iran-backed Hezbollah added in a statement that Iran had exercised its legal rights despite “threats, intimidation and pressure”.
Malaysia
Malaysian Prime Minister Anwar Ibrahim dubbed Iran’s attack as a “consequence of the Israeli government breaking international laws” by bombing the Iranian consulate on April 1.
He said the violence between the two regional rivals was not “good for the world economy and peace,” local English daily Malay Mail reported.
“The war between Iran and Israel that started after the Zionist Israeli government attacked the Iranian embassy, which is against international law, is a consequence of one’s actions. When you break the law you invite a reaction.”
Pakistan
“Today’s developments demonstrate the consequences of the breakdown of diplomacy,” the Pakistani Foreign Ministry said in a statement.
“These also underline the ‘grave’ implications in cases where the UN Security Council is unable to fulfil its responsibilities of maintaining international peace and security.”
For months, it added, Pakistan has underlined the necessity of international efforts to prevent expansion of hostilities in the region and for a cease-fire in Gaza.
“It’s now critically urgent to stabilise the situation and restore peace. We call on all parties to exercise utmost restraint,” it concluded.
Qatar
The Gulf nation called on all concerned parties to stop the escalation and exercise utmost restraint.
In a statement, the Qatari Ministry of Foreign Affairs expressed “its deep concern about the developments in the region”.
It called on “all parties to halt escalation, promote calm and exercise maximum restraint”.
It urged “the international community to take urgent action to defuse tension and de-escalate the situation in the region”.

Statement : Qatar Expresses Deep Concern about Regional Developments, Calls for De-Escalation, Restraint#MOFAQatar pic.twitter.com/64QS07pUoU
— Ministry of Foreign Affairs – Qatar (@MofaQatar_EN) April 14, 2024

Russia
Russia said it was extremely concerned by Iranian strikes on Israel and called on all parties to exercise restraint.
“We express our extreme concern over another dangerous escalation in the region,” Russia’s foreign ministry said in a statement on the Iranian attacks. “We call on all parties involved to exercise restraint.”
“We have repeatedly warned that the numerous unresolved crises in the Middle East, primarily in the Palestinian-Israeli conflict zone, which are often fuelled by irresponsible provocative actions, will lead to an increase in tension,” the ministry said.
Saudi Arabia
The Saudi Ministry of Foreign Affairs issued a statement voicing its concern at the “military escalation” and calling on “all parties to exercise utmost restraint and spare the region and its peoples from the dangers of war”.
It went on to urge the UN Security Council “to assume its responsibility towards maintaining international peace and security”.
Spain
Prime Minister Pedro Sanchez called for restraint, saying on X: “We are following with the greatest concern the evolution of the situation in the Middle East. One must at all cost avoid a regional escalation.”
 



 
Turkey
Turkey does not want further escalation of tension in the region after Iran’s drone and missile attack against Israel, Turkish foreign minister Hakan Fidan told his Iranian counterpart in a phone call on Sunday, Turkish diplomatic sources told Reuters.
Anadolu Agency reported Fidan held a call with UK’s Cameron “adding that both officials agreed that the region should not see any further escalation”, according to diplomatic sources.
Ukraine
President Volodymyr Zelenskyy condemned Iran’s drone and missile attack, calling for efforts to prevent a further escalation in Middle East conflict.
“Iran’s actions threaten the entire region and the world, just as Russia’s actions threaten a larger conflict, and the obvious collaboration between the two regimes in spreading terror must face a resolute and united response from the world,” he posted on X.

Ukraine condemns Iran’s attack on Israel using “Shahed” drones and missiles. We in Ukraine know very well the horror of similar attacks by Russia, which uses the same “Shahed” drones and Russian missiles, the same tactics of mass air strikes.
Every effort must be made to prevent…
— Volodymyr Zelenskyy / Володимир Зеленський (@ZelenskyyUa) April 14, 2024

United Kingdom
Prime Minister Rishi Sunak described Iran’s actions as “reckless”.
“Iran has once again demonstrated that it is intent on sowing chaos in its own backyard,” he said in a statement posted on X.
“The UK will continue to stand up for Israel’s security and that of all our regional partners, including Jordan and Iraq,” he added.

Read my statement on the Iranian regime’s reckless attack against Israel. pic.twitter.com/xeuR3cd3kG
— Rishi Sunak (@RishiSunak) April 13, 2024

United Nations
“I strongly condemn the serious escalation represented by the large-scale attack launched on Israel by the Islamic Republic of Iran this evening,” Secretary-General Antonio Guterres wrote in a statement.
“I am deeply alarmed about the very real danger of a devastating region-wide escalation. I urge all parties to exercise maximum restraint to avoid any action that could lead to major military confrontations on multiple fronts in the Middle East,” he added.
United States
President Joe Biden condemned the Iranian attacks and pledged a coordinated G7 diplomatic response. He said the US had helped Israel take down “nearly all” of the attacking drones and missiles.
Biden said in a statement released by the White House that he reiterated the “ironclad” US support for Israel’s security in a call with Prime Minister Benjamin Netanyahu.
“I told him that Israel demonstrated a remarkable capacity to defend against and defeat even unprecedented attacks – sending a clear message to its foes that they cannot effectively threaten the security of Israel,” he said in the statement.
“Tomorrow [Sunday], I will convene my fellow G7 leaders to coordinate a united diplomatic response to Iran’s brazen attack,” he said.
The US also does not want to see an escalation of the conflict in the region and Biden made clear to Netanyahu that Washington would not participate in any offensive action against Iran, according to a senior administration official who was not authorised to publicly discuss the private conversation between the two leaders.
Vatican
Pope Francis made a “pressing appeal” against a “spiral of violence”, warning of a potential regional conflagration.
“I make a pressing appeal for an end to any action which could fuel a spiral of violence that risks dragging the Middle East into an even greater conflict,” the Argentinian pontiff declared following his traditional Sunday prayer in Saint Peter’s Square at the Vatican.
“I am praying and following with concern, but also pain, the news that has come in recent hours about the worsening situation in Israel due to Iran’s intervention,” the pope told worshippers.
“No one should threaten the existence of others. All countries must, however, side with peace and help Israelis and Palestinians to live in two states, side by side and in security,” he said.
Yemen
Yemen’s armed Houthi movement said on Sunday that Iran’s attack on Israel was a legitimate act in response to a suspected Israeli strike on the Iranian consulate in Damascus on April 1.
A Houthi spokesman added that the Yemeni group had been in direct confrontation with Israel since October 7, by attacking the southern Israeli port of Eilat with missiles and drones and by preventing Israeli ships from sailing through the Red Sea.
Source: Al Jazeera and news agenciesaj-logoaj-logoaj-logoAboutShow moreAbout UsCode of EthicsTerms and ConditionsEU/EEA Regulatory NoticePrivacy PolicyCookie PolicyCookie PreferencesSitemapWork for usHR QualityConnectShow moreContact UsUser Accounts HelpAdvertise with usAppsNewslettersChannel FinderTV SchedulePodcastsSubmit a TipOur ChannelsShow moreAl Jazeera ArabicAl Jazeera EnglishAl Jazeera Investigative UnitAl Jazeera MubasherAl Jazeera DocumentaryAl Jazeera BalkansAJ+Our NetworkShow moreAl Jazeera Centre for StudiesAl Jazeera Media InstituteLearn ArabicAl Jazeera Centre for Public Liberties & Human RightsAl Jazeera ForumAl Jazeera Hotel PartnersFollow Al Jazeera English:facebooktwitteryoutubeinstagram-colored-outlinerss© 2024 Al Jazeera Media Network

"
"Amid the Israel-Iran escalation, it’s time for a region-wide ceasefire",2024-04-14,https://www.aljazeera.com/opinions/2024/4/14/amid-the-israel-iran-escalation-its-time-for-a-region-wide-ceasefire,"Amid the Israel-Iran escalation, it’s time for a region-wide ceasefire | Opinions | Al Jazeera






















Skip linksSkip to Contentplay Live Show navigation menuNavigation menuNewsShow more news sectionsMiddle EastAfricaAsiaUS & CanadaLatin AmericaEuropeAsia PacificIsrael War on GazaFeaturesOpinionVideoMoreShow more sectionsEconomyUkraine warCoronavirusClimate CrisisInvestigationsInteractivesIn PicturesScience & TechnologySportPodcastsplay Live Click here to searchsearchOPINIONOPINION, OpinionsAmid the Israel-Iran escalation, it’s time for a region-wide ceasefireUnless the world is ready for a regional war with global repercussions, it must move quickly.Daoud KuttabDaoud Kuttab is an award-winning Palestinian journalist.Published On 14 Apr 202414 Apr 2024An anti-missile system operates after Iran launched drones and missiles towards Israel, as seen from Ashkelon, Israel on April 14, 2024 [Reuters/Amir Cohen]When the Israeli Prime Minister Benjamin Netanyahu approved the air strike on the Iranian consulate in Damascus, he knew what he was doing. Although any attack on a diplomatic mission is a clear violation of the 1961 Vienna Convention on Diplomatic Relations, the Israeli leader proceeded, hoping to divert attention from his failures in the Israeli war on Gaza.
With Israel having previously carried out a series of assassinations against Iranian officials and scientists, this act was hard to deny. No other power in the region could conduct such a brazen violation of international law regarding the sanctity of diplomatic missions.
Coming on the heels of other Israeli attacks on Iranian targets in Syria, this was a provocative act aimed at establishing military hegemony in the region.
For their part, the Iranians were caught in a bind. The international response to the brazen Israeli defiance of international law was muted, especially in the West, and Tehran could no longer tolerate the Israeli provocations. Iran also has its own considerations of military deterrence in the region.
The result was an attack from Iranian territory, which sent a clear message to Israel and its allies. It demonstrated the Iranian capabilities but also provided space for de-escalation. Iranian Foreign Minister Hossein Amirabdollahian described the attack as “limited” and said Tehran had warned the United States ahead of launching it.
Thanks to a deployment of US forces to the region and Israel’s own air defence capabilities, nearly all of the drones and missiles Iran launched were intercepted.
This display of military power by Israel and Iran has left the rest of the Arab world terrified of what another regional war could do to an already devastated region. And if it is to take place, there will be not just regional, but global repercussions. Any regional Iranian-Israeli conflict will pull in the Gulf countries, but also the US, Russia and China, creating a potentially explosive global confrontation.
As Israel and Iran are establishing this new “balance of terror”, the international community has to act. The United Nations Security Council must pass a strong binding resolution imposing a full ceasefire in the region that includes the occupied Palestinian territories, Israel, Iran and all neighboring countries involved, as well as non-state actors.
Importantly, this resolution must recognise that at the core of much of the instability in the region is the unresolved Palestinian question.
Therefore, it needs to call for an end to Israel’s genocidal invasion of Gaza and the exchange of captives. It must provide a clear roadmap to Palestinian statehood and the end of the Israeli military control of all Arab territories occupied in 1967. It must create an international peacekeeping force that will ensure compliance by all parties, especially in Gaza but also in the West Bank, where settler violence has reached unprecedented levels.
A clear declaration in support of the Palestinian right to self-determination and a roadmap to its realisation is paramount now. Already most European countries have indicated their plans to join the list of 139 states that have recognised the state of Palestine.
This resolution should not repeat the mistakes of UNSC 2728 passed on March 25, which the US tried to undermine immediately by claiming that it was “nonbinding”. The resolution was binding but it lacked “teeth” – or clear measures to be undertaken in case of violation. That is why Israel ignored it.
A new resolution, therefore, will require the use of Chapter VII of the UN Charter. Article 41 of this chapter reads: “The Security Council may decide what measures not involving the use of armed force are to be employed to give effect to its decisions, and it may call upon the Members of the United Nations to apply such measures. These may include complete or partial interruption of economic relations and of rail, sea, air, postal, telegraphic, radio, and other means of communication, and the severance of diplomatic relations.”
The possibility of imposing biting sanctions and a diplomatic boycott on those who do not abide by its provisions must be made clear in the resolution. Mention must also be made of the other provisions in Chapter VII which include the use of military force to ensure maintenance of international peace.
For decades, Israel has gotten away with perpetrating egregious violations of international law because it has faced no consequences. Now the International Court of Justice has declared that Israeli actions in Gaza “plausibly” amount to genocide in Gaza. Israel will not stop its aggression in Gaza or elsewhere in the region unless it is faced with a credible threat of sanctions. Iran, for its part, already faces sanctions pressure from the West, but if China and other non-Western powers were to join such measures, it would think twice before violating the resolution.
With Iran clearly demonstrating it is willing to de-escalate after the attack, a small window of opportunity now exists for action. The US and other countries have come to the rescue of Israel and this means that it will have to pay back its allies by complying with the ceasefire.
Unless the world wants to deal with the economic and humanitarian catastrophe of a region-wide war in the Middle East, it must move quickly and lay the foundations for a comprehensive lasting peace in the region. The key to that is resolving the Palestinian question once and for all.
The views expressed in this article are the author’s own and do not necessarily reflect Al Jazeera’s editorial stance.
aj-logoaj-logoaj-logoAboutShow moreAbout UsCode of EthicsTerms and ConditionsEU/EEA Regulatory NoticePrivacy PolicyCookie PolicyCookie PreferencesSitemapWork for usHR QualityConnectShow moreContact UsUser Accounts HelpAdvertise with usAppsNewslettersChannel FinderTV SchedulePodcastsSubmit a TipOur ChannelsShow moreAl Jazeera ArabicAl Jazeera EnglishAl Jazeera Investigative UnitAl Jazeera MubasherAl Jazeera DocumentaryAl Jazeera BalkansAJ+Our NetworkShow moreAl Jazeera Centre for StudiesAl Jazeera Media InstituteLearn ArabicAl Jazeera Centre for Public Liberties & Human RightsAl Jazeera ForumAl Jazeera Hotel PartnersFollow Al Jazeera English:facebooktwitteryoutubeinstagram-colored-outlinerss© 2024 Al Jazeera Media Network

"
