Titulo,Fecha,URL,Contenido
‘Disastrous’: Israel-Iran tensions test limits of US policy amid Gaza war,2024-04-12,https://www.aljazeera.com/news/2024/4/12/disastrous-israel-iran-tensions-test-limits-of-us-policy-amid-gaza-war,"‘Disastrous’: Israel-Iran tensions test limits of US policy amid Gaza war | Israel War on Gaza News | Al Jazeera






















Skip linksSkip to Contentplay Live Show navigation menuNavigation menuNewsShow more news sectionsMiddle EastAfricaAsiaUS & CanadaLatin AmericaEuropeAsia PacificIsrael War on GazaFeaturesOpinionVideoMoreShow more sectionsEconomyUkraine warCoronavirusClimate CrisisInvestigationsInteractivesIn PicturesScience & TechnologySportPodcastsplay Live Click here to searchsearchNavigation menucaret-leftIsrael War on GazaLive updatesHow Iran attacked IsraelThe risks of a wider warWho will recognise Palestinian statehood?Six months of death and destructionA doctor's diaryThe lives lostPhotos: Six months of warAre Israel's allies complicit?'They scream in hunger'Live trackerMapping the destructioncaret-rightNews|Israel War on Gaza‘Disastrous’: Israel-Iran tensions test limits of US policy amid Gaza warBiden’s ‘ironclad’ backing of Israel is coming into conflict with the US’s stated goal of averting regional war, analysts say.US President Joe Biden, a self-described Zionist, has expressed unwavering support for Israel [Bonnie Cash/Reuters]By Ali HarbPublished On 12 Apr 202412 Apr 2024Washington, DC – United States President Joe Biden had a brief but stern warning for Iran as it promised to retaliate against Israel for a deadly air raid on its consulate in Damascus: “Don’t.”
But analysts say that Iran likely will launch its own attack, raising fears of a regional war and showing the limits of US deterrence efforts in the Middle East.Keep reading list of 3 itemslist 1 of 3Israel’s war on Gaza: List of key events, day 189list 2 of 3Will dissent in DC make a difference in Israel’s war on Gaza?list 3 of 3Journalist loses foot after being badly wounded in Israeli attack in Gazaend of list
The brinkmanship and resulting tensions have put further strain on Washington’s foreign policy. Already, the US is caught between two seemingly conflicting priorities: offering unconditional support for Israel and preventing the conflict in Gaza from expanding.
“Biden is doubling down on a formula that so far has been absolutely disastrous,” said Trita Parsi, executive vice president at the Quincy Institute, a think tank that promotes diplomacy.
Parsi said Biden should have rebuked Israel for attacking the Iranian embassy on April 1, violating international law and endangering US troops in the region.
But, he explained, the Biden administration is rewarding the Israeli government by promising to support it instead.
The US — unlike some of its Arab and Western allies — has not condemned the Israeli strike on the Iranian diplomatic facility in Syria, which killed seven members of the Islamic Revolutionary Guard Corps (IRGC), including two generals.
The White House, however, was quick to distance itself from the strike, stressing that the US was not involved in it.
 



 
US ‘devoted’ to Israel’s defence
US diplomats have reportedly been working the phones this week, speaking with their counterparts across the world to urge restraint from Iran.
While calling for de-escalation, US officials have also reaffirmed their country’s “ironclad” support for Israel, raising fears of a direct confrontation between Washington and Tehran.
“We are devoted to the defence of Israel. We will support Israel. We will help defend Israel, and Iran will not succeed,” Biden said on Friday. The Pentagon and State Department have also expressed similar positions.
“This completely deprives Israel of any incentives to de-escalate,” Parsi said.
He added that Biden’s backing of Israel mirrors his “bear hug” approach to Israeli Prime Minister Benjamin Netanyahu at the outset of the war on Gaza, which gave a green light to the mass killings and rights violations in the Palestinian territory.
“That helped shape Israel’s strategy that knew no limits, that did not care about international law — because they had come to understand that Biden will support them no matter what,” Parsi told Al Jazeera.
Sina Toossi, a senior fellow at the Center for International Policy think tank, called the US approach to the crisis “hypocritical and contradictory”.
“They’re calling on all the other parties in the region to be restrained, constantly telling the Iranians ‘don’t escalate’, whereas they encourage Israelis to act with total impunity,” Toossi told Al Jazeera.
Iran says Israel ‘must be punished’
He added that the Iranian pledge to retaliate is partly driven by the perception that the US and Israel believe they can cause harm without triggering a strong reaction from Tehran, which does not want a regional war.
But now Iran wants to draw a firm line, Toossi told Al Jazeera. “It can very objectively be stated that US policy has gotten us into this situation.”
 



 
The Israeli military has been targeting Iran-linked sites in Syria for years, as Tehran bolsters its military presence in the war-torn country.
But experts say Tehran saw bombing a diplomatic facility as a particularly brazen act that should not go unanswered.
“The consulate and embassy offices in any country are considered to be the territory of that country. When they attack our consulate, it means they have attacked our territory,” Iranian Supreme Leader Ali Khamenei said on Wednesday.
“The Zionist regime made a mistake and must be punished and will be punished.”
It remains to be seen where and how that promised punishment will come, but if it happens, it could be a turning point in the expanding Gaza conflict. Several countries have warned their citizens this week against travelling to the region.
The war on Gaza, which has killed more than 33,000 Palestinians, has already expanded beyond the narrow enclave.
Iran-allied Lebanese group Hezbollah has been exchanging fire with Israeli forces daily. The Houthis have been firing missiles and drones at Israel-linked ships in the Red Sea, demanding an end to the war, and a US-led coalition has been targeting the Yemeni group to stem its attacks.
But the trend towards regional escalation appeared to have subsided somewhat after Iraqi armed groups halted their attacks on US bases in Iraq and Syria — at the request of Tehran, according to several media reports.
A drone attack by Iran-backed Iraqi groups had killed three US soldiers at a base near the Jordan-Syria border. The US had then retaliated with a series of strikes in Iraq and Syria, but the crisis was eventually contained.
‘Pressure’ on US and Israel
Now the region is once again staring at the prospect of a widened conflict.
“The pressure is now on Israel and the US rather than Iran. And yes, there are a lot of threatening remarks directed at Iran in the hope that the Iranians don’t act. But the die was first cast by Israel,” said Vali Nasr, a professor of international affairs at John Hopkins University.
“And now people are trying to avoid what might be consequences.”
Biden does not want the US to be pulled into a war with Iran, particularly as he seeks reelection in November. But Washington’s default policy has long been to support Israel, Nasr added.
“The American position is that they don’t want the war to expand. They don’t want to be dragged into a war with Iran. They don’t want the Gaza war to become a regional war,” he told Al Jazeera.
“They may be saying things to Israel behind the scenes, but I think publicly they’re trying to warn Iran not to escalate the war as well.”
But he added that every country has to contend with domestic politics in its foreign policy. “And in the United States, giving ironclad guarantees to Israel’s defence is already a given.”
In Washington, Iran hawks are urging a forceful American response if Israel is attacked.
Republican Senator Tom Cotton called on Wednesday for “joint American-Israeli retaliation” that would be “swift and devastating” to any Iranian military move against Israel.

Israel is under threat of imminent attack by Iran. President Biden needs to warn the ayatollahs immediately that the United States will back Israel to the hilt and the joint American-Israeli retaliation for any attack will be swift and devastating.
— Tom Cotton (@SenTomCotton) April 11, 2024

‘Obvious de-escalatory path’
Ryan Costello, policy director at the National Iranian American Council (NIAC), a Washington, DC-based group that favours US diplomacy with Iran, warned that if the US joins Israel in reprisal strikes, the results could be catastrophic.
“It’s really reckless and would certainly plunge the entire region into a disastrous and bloody conflict,” he told Al Jazeera.
Costello said the US posture so far has been heavy on deterrence and light on de-confliction.
“They’re saying Israel is going to have our backing, and Iran should just accept the strike on a diplomatic compound, which I think would be hard for any nation to accept,” he said.
For his part, Parsi of the Quincy Institute stressed that the best remedy to the simmering tensions across the Middle East is ending the war in Gaza.
“In the broader picture, there has of course been an obvious de-escalatory path that has always been available to Biden, and that is to push for a ceasefire in Gaza,” Parsi said.
“A ceasefire would have stopped the attacks by Iraqi militias on the US, would have stopped the Houthi attacks, would have stopped the escalation between Iran and Israel and Israel and Hezbollah.”
Source: Al Jazeeraaj-logoaj-logoaj-logoAboutShow moreAbout UsCode of EthicsTerms and ConditionsEU/EEA Regulatory NoticePrivacy PolicyCookie PolicyCookie PreferencesSitemapWork for usHR QualityConnectShow moreContact UsUser Accounts HelpAdvertise with usAppsNewslettersChannel FinderTV SchedulePodcastsSubmit a TipOur ChannelsShow moreAl Jazeera ArabicAl Jazeera EnglishAl Jazeera Investigative UnitAl Jazeera MubasherAl Jazeera DocumentaryAl Jazeera BalkansAJ+Our NetworkShow moreAl Jazeera Centre for StudiesAl Jazeera Media InstituteLearn ArabicAl Jazeera Centre for Public Liberties & Human RightsAl Jazeera ForumAl Jazeera Hotel PartnersFollow Al Jazeera English:facebooktwitteryoutubeinstagram-colored-outlinerss© 2024 Al Jazeera Media Network

"
"France, India, Russia, UK issue travel warnings over Israel-Iran tensions",2024-04-12,https://www.aljazeera.com/news/2024/4/12/france-india-russia-uk-issue-travel-warnings-over-israel-iran-tensions,"France, India, Russia, UK issue travel warnings over Israel-Iran tensions | Conflict News | Al Jazeera






















Skip linksSkip to Contentplay Live Show navigation menuNavigation menuNewsShow more news sectionsMiddle EastAfricaAsiaUS & CanadaLatin AmericaEuropeAsia PacificIsrael War on GazaFeaturesOpinionVideoMoreShow more sectionsEconomyUkraine warCoronavirusClimate CrisisInvestigationsInteractivesIn PicturesScience & TechnologySportPodcastsplay Live Click here to searchsearchNews|ConflictFrance, India, Russia, UK issue travel warnings over Israel-Iran tensionsWarnings come as Tehran promises reprisals against Israel for the deadly April 1 attack on an Iranian consulate in Syria.An excavator clears rubble after an attack on April 1, 2024, on Iran's consulate in the Syrian capital, Damascus [File: Firas Makdesi/Reuters]Published On 12 Apr 202412 Apr 2024|Updated: 12 Apr 202408:29 PM (GMT)Countries including France, India, Russia, Poland and the United Kingdom have warned their citizens against travelling to Israel, the occupied Palestinian territories and, in some cases, the wider region amid threats of an Iranian attack in response to a strike this month on its consulate in Damascus.
Iran has threatened reprisals against Israel over the strike in the Syrian capital on April 1, which killed seven Islamic Revolutionary Guard Corps members, including two generals, leading to fears of an escalation of violence in the Middle East.Keep reading list of 4 itemslist 1 of 4Iran’s Khamenei promises ‘Israel will be punished’ for Syria strikelist 2 of 4Who was Mohammad Reza Zahedi, an Iranian general killed by Israel in Syria?list 3 of 4IRGC warns Israel attacks ‘won’t go unanswered’ as Iran marks Al-Quds Daylist 4 of 4Tensions rise amid expectations of Iran retaliation against Israelend of list
The French Ministry for Europe and Foreign Affairs on Friday advised its citizens against travelling to Iran, Lebanon, Israel and the Palestinian territories.
In a statement on the social media platform X, the ministry added that relatives of Iran-based diplomats will return to France and French civil servants are now banned from conducting any missions in the countries and territories in question.
The UK told its citizens to avoid all but essential travel to Israel and Palestine over the “possibility of an attack on Israeli territory from Iran”.
In an update, the British Foreign and Commonwealth Office warned against “all travel” to northern Israel, the Gaza Strip, areas near Gaza and the occupied West Bank – excluding occupied East Jerusalem and Route 1 between Jerusalem and Tel Aviv.
 



 
Russia strongly recommended its citizens “refrain from travelling to the region”, emphasising security risks in Israel, Lebanon and Palestine.
“The situation in the Palestinian-Israeli conflict zone as well as in the area of the ‘Blue Line’ between Lebanon and Israel remains unstable,” its Ministry of Foreign Affairs said.
Poland’s Foreign Ministry also advised against travel to Israel, Palestine and Lebanon.
“It cannot be ruled out that there will be a sudden escalation of military operations, which would cause significant difficulties in leaving these three countries,” it said in a statement. “Any escalation may lead to significant restrictions in air traffic and the inability to cross land border crossings.”
India’s statement covered Iran and Israel, calling on Indians not to go to the two countries until further notice in view of the “prevailing situation in the region”.
The Ministry of External Affairs in New Delhi said Indian citizens who are in the two countries should observe “utmost precautions about their safety and restrict their movements to the minimum”.
Germany meanwhile warned its citizens to leave Iran specifically, saying escalating tensions could affect exit routes.
“In the current tensions, especially between Israel and Iran, there is a risk of a sudden escalation,” the Foreign Office said. “German citizens are at concrete risk of being arbitrarily arrested and interrogated and being given long prison sentences. Dual citizens with Iranian and German nationality are especially at risk,” it added.
Separately, German flagship airline Lufthansa extended its suspension of flights to and from Tehran until Thursday and will not use Iranian airspace during that time.
 



 
Real and viable threat, US says
The United States has restricted its employees in Israel and their family members from personal travel outside the greater Tel Aviv, Jerusalem and Beersheba areas.
An imminent attack by Iran on Israel is a “real” and “viable” threat, US National Security Council spokesman John Kirby told journalists on Friday, adding that Washington would make sure the Israelis “have what they need and that they’re able to defend themselves”.
Speaking to reporters on Friday, President Joe Biden said: “We are devoted to the defence of Israel. We will support Israel. We will help defend Israel, and Iran will not succeed.”
The top US commander for the Middle East, General Erik Kurilla, is also in Israel for talks with its military officials on security threats. His trip was moved up from a previously scheduled date “due to recent developments”, Pentagon spokesman Major General Pat Ryder said on Thursday.
After Kurilla discussed the tensions with Iran with Israeli Defence Minister Yoav Gallant on Friday, Gallant said the US and Israel were “shoulder to shoulder” in facing possible threats.
“We are prepared to defend ourselves on the ground and in the air, in close cooperation with our partners, and we will know how to respond,” the defence chief added.
The Wall Street Journal, quoting a person familiar with the matter, reported on Thursday that Israel was preparing for an attack by Iran as soon as Friday or Saturday.
Al Jazeera’s Hamdah Salhut, reporting from East Jerusalem, said the Israeli army announced that it was preparing on all fronts offensively and defensively.
“A couple of weeks ago, the Israelis increased their alertness level, calling up reservists and bolstering air defence systems,” she said, adding that Israeli officials said they were prepared for anything.
Israel has bombarded the Gaza Strip since October 7 and sent in ground forces, killing at least 33,600 Palestinians and injuring more than 76,000. Hamas’s October 7 attacks on southern Israel killed more than 1,100 people there.
Israel has also stepped up strikes against Iranian personnel and allies in Syria and Lebanon and has traded near daily cross-border fire with the Lebanese group Hezbollah since the start of the war.
 



 
Source: Al Jazeera and news agenciesaj-logoaj-logoaj-logoAboutShow moreAbout UsCode of EthicsTerms and ConditionsEU/EEA Regulatory NoticePrivacy PolicyCookie PolicyCookie PreferencesSitemapWork for usHR QualityConnectShow moreContact UsUser Accounts HelpAdvertise with usAppsNewslettersChannel FinderTV SchedulePodcastsSubmit a TipOur ChannelsShow moreAl Jazeera ArabicAl Jazeera EnglishAl Jazeera Investigative UnitAl Jazeera MubasherAl Jazeera DocumentaryAl Jazeera BalkansAJ+Our NetworkShow moreAl Jazeera Centre for StudiesAl Jazeera Media InstituteLearn ArabicAl Jazeera Centre for Public Liberties & Human RightsAl Jazeera ForumAl Jazeera Hotel PartnersFollow Al Jazeera English:facebooktwitteryoutubeinstagram-colored-outlinerss© 2024 Al Jazeera Media Network

"
"Israel’s war on Gaza updates: Iran sends drones, missiles towards Israel",2024-04-13,https://www.aljazeera.com/news/liveblog/2024/4/13/israels-war-on-gaza-live-5-dead-dozens-injured-in-gaza-city-attack?update=2834419,"Israel’s war on Gaza updates: Iran sends drones, missiles towards Israel | Israel War on Gaza News | Al Jazeera






















Skip linksSkip to Contentplay Live Show navigation menuNavigation menuNewsShow more news sectionsMiddle EastAfricaAsiaUS & CanadaLatin AmericaEuropeAsia PacificIsrael War on GazaFeaturesOpinionVideoMoreShow more sectionsEconomyUkraine warCoronavirusClimate CrisisInvestigationsInteractivesIn PicturesScience & TechnologySportPodcastsplay Live Click here to searchsearchNavigation menucaret-leftIsrael War on GazaLive updatesHow Iran attacked IsraelThe risks of a wider warWho will recognise Palestinian statehood?Six months of death and destructionA doctor's diaryThe lives lostPhotos: Six months of warAre Israel's allies complicit?'They scream in hunger'Live trackerMapping the destructioncaret-rightIsrael’s war on Gaza updates: Iran sends drones, missiles towards IsraelIran says it is retaliating for Israel’s bombing of its consulate in Syria earlier this month.Smoke rises as the Israeli army raids the Nuseirat refugee camp in Deir el-Balah, Gaza on April 12, 2024 [Ashraf Amra/Anadolu]By Adam Muro, Virginia Pietromarchi, Edna Mohamed, Nils Adler and Lyndal RowlandsPublished On 13 Apr 202413 Apr 2024This live page is now closed. Please follow the latest updates here.Read moreAboutShow moreAbout UsCode of EthicsTerms and ConditionsEU/EEA Regulatory NoticePrivacy PolicyCookie PolicyCookie PreferencesSitemapWork for usHR QualityConnectShow moreContact UsUser Accounts HelpAdvertise with usAppsNewslettersChannel FinderTV SchedulePodcastsSubmit a TipOur ChannelsShow moreAl Jazeera ArabicAl Jazeera EnglishAl Jazeera Investigative UnitAl Jazeera MubasherAl Jazeera DocumentaryAl Jazeera BalkansAJ+Our NetworkShow moreAl Jazeera Centre for StudiesAl Jazeera Media InstituteLearn ArabicAl Jazeera Centre for Public Liberties & Human RightsAl Jazeera ForumAl Jazeera Hotel PartnersFollow Al Jazeera English:facebooktwitteryoutubeinstagram-colored-outlinerss© 2024 Al Jazeera Media Network

"
Israel’s war on Gaza updates: UN chief says Middle East ‘on the brink’,2024-04-14,https://www.aljazeera.com/news/liveblog/2024/4/14/israels-war-on-gaza-live-blasts-sirens-as-iranian-missiles-intercepted,"Israel’s war on Gaza updates: UN chief says Middle East ‘on the brink’ | Israel War on Gaza News | Al Jazeera






















Skip linksSkip to Contentplay Live Show navigation menuNavigation menuNewsShow more news sectionsMiddle EastAfricaAsiaUS & CanadaLatin AmericaEuropeAsia PacificIsrael War on GazaFeaturesOpinionVideoMoreShow more sectionsEconomyUkraine warCoronavirusClimate CrisisInvestigationsInteractivesIn PicturesScience & TechnologySportPodcastsplay Live Click here to searchsearchNavigation menucaret-leftIsrael War on GazaLive updatesHow Iran attacked IsraelThe risks of a wider warWho will recognise Palestinian statehood?Six months of death and destructionA doctor's diaryThe lives lostPhotos: Six months of warAre Israel's allies complicit?'They scream in hunger'Live trackerMapping the destructioncaret-rightIsrael’s war on Gaza updates: UN chief says Middle East ‘on the brink’Iranian officials warn Israel of a larger attack should it respond to overnight drone and missile assault.[Majid Asgaripour/WANA (West Asia News Agency) via Reuters]By Tamila Varshalomidze, Edna Mohamed and Nils AdlerPublished On 14 Apr 202414 Apr 2024This page is now closed. Follow the latest updates here.Read moreAboutShow moreAbout UsCode of EthicsTerms and ConditionsEU/EEA Regulatory NoticePrivacy PolicyCookie PolicyCookie PreferencesSitemapWork for usHR QualityConnectShow moreContact UsUser Accounts HelpAdvertise with usAppsNewslettersChannel FinderTV SchedulePodcastsSubmit a TipOur ChannelsShow moreAl Jazeera ArabicAl Jazeera EnglishAl Jazeera Investigative UnitAl Jazeera MubasherAl Jazeera DocumentaryAl Jazeera BalkansAJ+Our NetworkShow moreAl Jazeera Centre for StudiesAl Jazeera Media InstituteLearn ArabicAl Jazeera Centre for Public Liberties & Human RightsAl Jazeera ForumAl Jazeera Hotel PartnersFollow Al Jazeera English:facebooktwitteryoutubeinstagram-colored-outlinerss© 2024 Al Jazeera Media Network

"
