Titulo,Fecha,URL,Contenido
"Iran attacks Israel with over 300 drones, missiles: What you need to know",2024-04-14,https://www.aljazeera.com/news/2024/4/14/iran-attacks-israel-with-over-300-drones-missiles-what-you-need-to-know,"Iran attacks Israel with over 300 drones, missiles: What you need to know | Explainer News | Al Jazeera






















Skip linksSkip to Contentplay Live Show navigation menuNavigation menuNewsShow more news sectionsMiddle EastAfricaAsiaUS & CanadaLatin AmericaEuropeAsia PacificIsrael War on GazaFeaturesOpinionVideoMoreShow more sectionsEconomyUkraine warCoronavirusClimate CrisisInvestigationsInteractivesIn PicturesScience & TechnologySportPodcastsplay Live Click here to searchsearchEXPLAINERNews|ExplainerIran attacks Israel with over 300 drones, missiles: What you need to knowIran has launched a massive aerial attack on Israel, two weeks after a deadly strike on its consulate in Syria.play videoplay videoVideo Duration 22 minutes 44 seconds 22:44By Al Jazeera StaffPublished On 14 Apr 202414 Apr 2024|Updated: 2 hours agoIran unleashed a barrage of missiles and drones on Saturday night and early on Sunday, targeting Israel in retaliation for April 1’s suspected Israeli strike on its consulate in Damascus, which killed 13 people.
Here is what happened and what analysts say could happen next:
What happened in Israel and when?

Iran’s massive aerial attack marks the first direct strike by Iran on Israeli territory from Iranian soil. Iran called the attack Operation True Promise.
The attack began on Saturday about 20:00 GMT. It lasted about five hours, according to United States officials.
During the attack, explosions were heard in cities across Israel, including Tel Aviv. The explosions were also heard in Jerusalem, and air raid sirens sounded in more than 720 locations as Israeli forces sought to shoot down the projectiles.
Israel’s chief military spokesman, Daniel Hagari, said Iran’s attack involved more than 120 ballistic missiles, 170 drones and more than 30 cruise missiles, according to a report by The Associated Press news agency.
The Israeli military also said the vast majority of the projectiles were intercepted outside the country’s borders with help from the US, the United Kingdom and France. Jordan also shot down some of the missiles aimed at Israel as they were flying through Jordanian airspace.
Israel’s military added that a “small number of hits were identified”. In a base in southern Israel, “minor damage occurred to the infrastructure”, it said.
A seven-year-old girl was also severely injured by missile fragments while other patients sustained minor injuries and some were treated for anxiety.
US Defense Secretary Lloyd Austin said on Sunday that the US also intercepted “dozens” of missiles and drones launched at Israel from Iraq, Syria and Yemen.

 



 
Where exactly did the attacks take place?

During the attack, Israel’s military ordered residents in the northern Israeli-occupied Golan Heights – near the Syrian and Lebanese borders – and in the southern cities of Nevatim, Dimona and Eilat to remain near bomb shelters.
Nevatim is the site of an Israeli airbase while Dimona has a nuclear reactor on its outskirts. Eilat is Israel’s Red Sea port, which has suffered a sharp decline in operations because of repeated attacks by Yemen’s Houthis on ships using the waterway.


Why did Iran attack Israel?

Iran carried out the attacks in retaliation for a suspected Israeli strike that killed an Iranian military commander, Major General Mohammad Reza Zahedi, in Damascus on April 1. He was killed along with six other Iranian nationals, including another general. At least six Syrian citizens were also killed.
“It seems that Iranian leaders are determined to take action but also [be] seen to take action,” David Des Roches, an associate professor at the National Defense University in Washington, DC, told Al Jazeera.
“What that indicates to me is that there are considerations of pride and prestige that are divorced from strategy and tactical utility that may indicate a more dangerous era than we thought,” he added.
Hezbollah, a Lebanese armed group backed by Iran, and the Israeli military have been trading attacks across the Lebanon-Israel border since October 8, the day after the Hamas-led attacks in southern Israel and Israel’s brutal retaliation on the besieged Gaza Strip.
On Saturday, Iranian state media announced that the armed forces had seized an Israel-linked container ship near the Strait of Hormuz.

(Al Jazeera)
What is the Israeli government saying?


Prime Minister Benjamin Netanyahu said Israel “will win” in a tweet after the attacks. Earlier, he spoke to the nation, stating that the military was prepared for any scenario.  



“Citizens of Israel, in recent years and especially in recent weeks, Israel has been preparing for a direct attack by Iran,” Netanyahu said.
“Our defensive systems are deployed. We are ready for any scenario, both defensively and offensively. The State of Israel is strong. The [Israeli army] is strong. The public is strong.” He also thanked his allies, including the US and UK, for “standing alongside” Israel.
Towards the end of Sunday, the Israeli war cabinet – comprising Netanyahu, Defence Minister Yoav Gallant, Minister Benny Gantz and several observers – met to discuss a response to the attacks but were divided on how and when to respond, according to media reports.
A senior official from US President Joe Biden’s administration said Israel was not seeking to escalate the situation.
“I think Israel made clear to us they’re not looking for a significant escalation with Iran. That’s not what they’re looking for. They’re looking to protect themselves and defend themselves,” the official said.

 



 
What is the Iranian government saying?

Iran warned Israel against any response. The chief of staff of the Iranian armed forces, Major General Mohammad Bagheri, told state TV that if Israel retaliates, Iran’s response would be “much larger” than the overnight bombardment, according to a report by the Reuters news agency.

Iran also warned Washington that backing Israeli retaliation would lead to the targeting of US bases.


Earlier, Iran’s mission to the United Nations cited the UN Charter’s provision for self-defence under Article 51 and said the country considered “the matter … concluded”.

“The matter can be deemed concluded. However, should the Israeli regime make another mistake, Iran’s response will be considerably more severe,” it said on X. “It is a conflict between Iran and the rogue Israeli regime, from which the US MUST STAY AWAY!”
President Ebrahim Raisi issued a statement hailing the “brave men” of Iran’s Islamic Revolutionary Guard Corps who “taught a lesson to the Zionist regime”.


Conducted on the strength of Article 51 of the UN Charter pertaining to legitimate defense, Iran’s military action was in response to the Zionist regime’s aggression against our diplomatic premises in Damascus. The matter can be deemed concluded. However, should the Israeli…
— Permanent Mission of I.R.Iran to UN, NY (@Iran_UN) April 13, 2024

What could come next for Iran, Israel and the region?

Gideon Levy, an Israeli journalist and author, spoke to Al Jazeera about what could come next and said that if Israel were to strike back, “we are facing a regional war.”  It is a scenario he does not think will happen, especially, he said, “after the very clear and impressive aid of the United States to Israel”.
“The extent of the Biden administration’s support means Israel will have to follow the US government’s advice not to retaliate after last night’s attack,” Levy said.
“Netanyahu cannot attack Iran without the backing of the US and be exposed to a worse attack than last night,” he added.
Separately, analyst and journalist Daoub Kuttab wrote that the exchange between Israel and Iran “has left the rest of the Arab world terrified of what another regional war could do to an already devastated region”.
“And if it is to take place, there will be not just regional, but global repercussions,” he added.
“Any regional Iranian-Israeli conflict will pull in the Gulf countries but also the US, Russia and China, creating a potentially explosive global confrontation.”

 



 
What are the international reactions so far?

The aerial assault has drawn condemnation from Israel’s allies and warnings that it risked further escalation in the Middle East.
Biden made clear that the US will not participate in any offensive operations against Iran, according to a senior administration official. But he reiterated his support for Israel.
“Israel demonstrated a remarkable capacity to defend against and defeat even unprecedented attacks – sending a clear message to its foes that they cannot effectively threaten the security of Israel,” the White House quoted Biden as saying.
The UN Security Council held a meeting and called on Iran and Israel to show restraint. “Neither the region nor the world can afford more war,” Secretary-General Antonio Guterres told the meeting. “Now is the time to defuse and de-escalate.”
Jordanian Foreign Minister Ayman Safadi warned of the risk of a spillover conflict in the Middle East, stating that any escalation in the region would lead to “dangerous paths”.

Saudi Arabia’s Ministry of Foreign Affairs expressed concern over the “military escalation” and called for restraint from all parties.

China also said it was deeply concerned about escalation, adding that it was a “spillover of the Gaza conflict” and a ceasefire should be implemented without delay.
India also expressed concern and called for an “immediate de-escalation, exercise of restraint, stepping back from violence and return to the path of democracy”.
After a meeting on Sunday, the leaders of the Group of Seven (G7) said: “We … unequivocally condemn in the strongest terms Iran’s direct and unprecedented attack against Israel.”
The G7 said these actions “risks provoking an uncontrollable regional escalation. … This must be avoided. We will continue to work to stabilise the situation and avoid further escalation.”

For more global reactions, follow our coverage here.
 



 
Source: Al Jazeeraaj-logoaj-logoaj-logoAboutShow moreAbout UsCode of EthicsTerms and ConditionsEU/EEA Regulatory NoticePrivacy PolicyCookie PolicyCookie PreferencesSitemapWork for usHR QualityConnectShow moreContact UsUser Accounts HelpAdvertise with usAppsNewslettersChannel FinderTV SchedulePodcastsSubmit a TipOur ChannelsShow moreAl Jazeera ArabicAl Jazeera EnglishAl Jazeera Investigative UnitAl Jazeera MubasherAl Jazeera DocumentaryAl Jazeera BalkansAJ+Our NetworkShow moreAl Jazeera Centre for StudiesAl Jazeera Media InstituteLearn ArabicAl Jazeera Centre for Public Liberties & Human RightsAl Jazeera ForumAl Jazeera Hotel PartnersFollow Al Jazeera English:facebooktwitteryoutubeinstagram-colored-outlinerss© 2024 Al Jazeera Media Network

"
"Jordan, Lebanon, Iraq reopen airspace closed over Iran’s attacks on Israel",2024-04-14,https://www.aljazeera.com/news/2024/4/14/jordan-lebanon-iraq-reopen-airspace-closed-over-irans-attacks-on-israel,"Jordan, Lebanon, Iraq reopen airspace closed over Iran’s attacks on Israel | Aviation News | Al Jazeera






















Skip linksSkip to Contentplay Live Show navigation menuNavigation menuNewsShow more news sectionsMiddle EastAfricaAsiaUS & CanadaLatin AmericaEuropeAsia PacificIsrael War on GazaFeaturesOpinionVideoMoreShow more sectionsEconomyUkraine warCoronavirusClimate CrisisInvestigationsInteractivesIn PicturesScience & TechnologySportPodcastsplay Live Click here to searchsearchNews|AviationJordan, Lebanon, Iraq reopen airspace closed over Iran’s attacks on IsraelThe Arab nations had closed their airspaces after Iran’s drone and missile attacks on Israel, but many flights remain affected.Emirates announced the cancellation of some of its flights and the re-routing of others [File: Toby Melville/Reuters]Published On 14 Apr 202414 Apr 2024Jordan, Iraq and Lebanon have reopened their airspaces after closing them over Iran’s unprecedented drone and missile attacks on Israel.
Jordan’s state TV on Sunday said the country had resumed air traffic operations, citing aviation authorities. The opening of its airspace came more than three hours earlier than scheduled.Keep reading list of 4 itemslist 1 of 4‘True Promise’: Why and how did Iran launch a historic attack on Israel?list 2 of 4Iran launches hundreds of missiles, drones in first direct attack on Israellist 3 of 4Hamas backs Iran after retaliatory missile, drone attacks on Israellist 4 of 4Biden vows G7 response, ‘ironclad’ US support for Israel after Iran attacksend of list
Lebanon said its airport will resume its activities after the overnight closure, state TV reported.
Iraq’s aviation authority said security risks had now been overcome.
Meanwhile, Israel also reopened its airspace as of 7:30am (04:30 GMT) on Sunday, adding that flight schedules from Tel Aviv were expected to be affected.
Flag carrier El Al said it had resumed operations and was “working to stabilise the flight schedule as soon as possible”. “El Al will continue to operate as much as possible to preserve the air bridge to and from Israel,” it said.
 



 
Late on Saturday night, Iran launched explosive drones and fired missiles at Israel – its first direct attack on Israeli territory in a retaliatory strike that raises the threat of wider regional conflict.
Tehran had pledged to retaliate for what it says was an Israeli attack on Iran’s embassy compound last week in Damascus that killed a senior commander in the Iranian Revolutionary Guard Corps’s overseas Quds Force and six other officers.
Jordan, which lies between Iran and Israel, had readied air defences to intercept any drones or missiles that violated its territory, two regional security sources told the Reuters news agency.
Jordan said it intercepted some flying objects that entered its airspace last night to ensure the safety of citizens, a cabinet statement said.
“Some shrapnel fell in multiple places during that time without causing any significant damage or any injuries to citizens,” it added.
Reaction to Iran’s strikes has been swift, with many countries describing the attacks as a serious escalation, with potentially widespread consequences for the region.
The attacks come amid the ongoing Israeli war on Gaza, which shows no sign of easing despite numerous mediation efforts.
 



 
Meanwhile, global airlines have also been cancelling flights and changing routes after Iran’s attacks.
The United Arab Emirates-based Emirates announced the cancellation of some of its flights and the re-routing of others, the airline’s spokesperson said.
“We are closely monitoring the situation and making all efforts to ensure minimal disruption to customers after recent airspace closures,” a spokesperson from the airline said.
Abu Dhabi-based Etihad Airways cancelled flights to Jordan and Israel on Sunday, the airline said in a statement.
Swiss International Air Lines has suspended flights to and from Tel Aviv until further notice, the airline said in a post on social media platform X on Sunday.
Swiss, which is owned by German carrier Lufthansa, said all of its planes were avoiding the airspaces of Iran, Iraq and Israel, causing delays to flights from India and Singapore.
Lufthansa said it was suspending flights to Amman, Beirut, Erbil and Tel Aviv at least until Monday following the latest turmoil in the Middle East.
In a statement to Reuters news agency, the German carrier said it would also ensure its flights avoided the airspace above Israel, Jordan and Iraq for the foreseeable future.
Austrian Airlines, which is also part of the Lufthansa Group, announced it was suspending flights to Tehran until April 18.
“Long-haul routes through the Middle East will also be rerouted accordingly due to various airspace closures,” the airline said in a statement.
As a precaution, Iran’s Imam Khomeini international airport and the Mehrabad airport, which is mainly dedicated to domestic flights, will remain closed until Monday at 06:00 am (0230 GMT), according to ISNA news agency.
Source: News Agenciesaj-logoaj-logoaj-logoAboutShow moreAbout UsCode of EthicsTerms and ConditionsEU/EEA Regulatory NoticePrivacy PolicyCookie PolicyCookie PreferencesSitemapWork for usHR QualityConnectShow moreContact UsUser Accounts HelpAdvertise with usAppsNewslettersChannel FinderTV SchedulePodcastsSubmit a TipOur ChannelsShow moreAl Jazeera ArabicAl Jazeera EnglishAl Jazeera Investigative UnitAl Jazeera MubasherAl Jazeera DocumentaryAl Jazeera BalkansAJ+Our NetworkShow moreAl Jazeera Centre for StudiesAl Jazeera Media InstituteLearn ArabicAl Jazeera Centre for Public Liberties & Human RightsAl Jazeera ForumAl Jazeera Hotel PartnersFollow Al Jazeera English:facebooktwitteryoutubeinstagram-colored-outlinerss© 2024 Al Jazeera Media Network

"
What does Israel want to do after Iran’s drone and missile attacks?,2024-04-14,https://www.aljazeera.com/news/2024/4/14/what-does-israel-want-to-do-after-irans-drone-and-missile-attacks,"What does Israel want to do after Iran’s drone and missile attacks? | Israel War on Gaza News | Al Jazeera






















Skip linksSkip to Contentplay Live Show navigation menuNavigation menuNewsShow more news sectionsMiddle EastAfricaAsiaUS & CanadaLatin AmericaEuropeAsia PacificIsrael War on GazaFeaturesOpinionVideoMoreShow more sectionsEconomyUkraine warCoronavirusClimate CrisisInvestigationsInteractivesIn PicturesScience & TechnologySportPodcastsplay Live Click here to searchsearchNavigation menucaret-leftIsrael War on GazaLive updatesHow Iran attacked IsraelThe risks of a wider warWho will recognise Palestinian statehood?Six months of death and destructionA doctor's diaryThe lives lostPhotos: Six months of warAre Israel's allies complicit?'They scream in hunger'Live trackerMapping the destructioncaret-rightNews|Israel War on GazaWhat does Israel want to do after Iran’s drone and missile attacks?Analysts look at the reasons behind Israel’s attack on Iran’s consulate, which triggered Iran’s overnight barrage on Israel.The Iranian flag (left) and the Israeli flag [Getty Images]By Simon Speakman CordallPublished On 14 Apr 202414 Apr 2024Israel is reportedly unable to agree on a response to an overnight barrage of more than 300 Iranian drones and missiles, launched in response to Israel’s own strike on the Iranian consulate in Damascus on April 1.
According to the Israeli army, 99 percent of the projectiles were intercepted by its jets and those of its allies, including the United States and Jordan. Others were stopped by Israel’s Iron Dome missile defence system, acquired and operated with US help.Keep reading list of 3 itemslist 1 of 3‘True Promise’: Why and how did Iran launch a historic attack on Israel?list 2 of 3Iran warns Israel, US of ‘severe response’ in case of retaliationlist 3 of 3Iran attacks Israel with over 300 drones, missiles: What you need to knowend of list
While Western diplomats and US President Joe Biden have reportedly told Israeli Prime Minister Benjamin Netanyahu they will not support further retaliation, some analysts suggest that last night’s strikes may be part of a wider ploy to draw the US, Israel’s close ally, into a broader regional war.
Laying the foundation on April 1?
In determining how Israel may respond to the overnight attack, analysts have focused on Israel’s own attack on the Iranian consulate on April 1.
That strike, which killed two Islamic Revolutionary Guard Corps (IRGC) generals and five officers, was carried out with scant regard to Israel’s allies, who were only notified shortly ahead of the attack, according to at least one analyst Al Jazeera spoke to.
Hamidreza Azizi, a visiting fellow at SWP Berlin, outlined two scenarios, both resting upon the motivations behind the Israeli attack on the Iranian consulate.
 



 
In the first scenario, the Israeli strike occurred with little or no thought given to the consequences. In the second, the strike was a deliberate attempt to draw Iran into regional war and shift US and Western focus away from Israel’s war on Gaza and towards the regional bogeyman, Iran.
In both scenarios, US involvement would be critical.
Despite its status as a regional superpower, Israel – overstretched by six months of war on Gaza – would stand little chance against Iran’s standing army of at least 580,000, supplemented by some 200,000 trained reserve personnel, divided among the army and the IRGC.
“Netanyahu’s plan is clear, to distract attention from the war in Gaza and to drag the US and other Western allies back into the Middle East,”  Nomi Bar-Yaacov, an associate fellow at Chatham House, said.
“Given the close relationship between Israel and the US and Israel’s dependency on US aid, Israel should have informed the US that it was planning to attack the Iranian consulate building where the IRGC is based.
“By not doing so, Israel crossed a red line. Israel’s motives … need to be questioned. An attack on a foreign consulate constitutes a strike on foreign soil under international law, and it is clear that Netanyahu knew he was crossing the line and that Iran would respond with force,” she said.
Passions ran high in Iran after the assassination of seven IRGC members in Syria. Shown here is the funeral procession for them in Tehran on April 5, 2024 [Atta Kenare/AFP]
For years, Iran has maintained steady pressure on Israel through its proxies, not least Hezbollah in Lebanon, which has maintained an exchange of fire with Israel dating back from before October 7.
Eyes on the prize
Netanyahu’s motivations for attempting to claw the US into the war likely run deeper than Israel’s interests alone, analysts say, and likely speak to concerns closer to his heart.
Polls in Israel show the prime minister’s popularity to be at a critical low. After Netanyahu built his reputation upon claims that only he and his Likud Party stood between Israelis and oblivion, the surprise attack by Hamas-led fighters on October 7 has severely damaged his standing.
“Israel’s options are most impacted by how Netanyahu, who is embattled domestically and internationally, will choose to take advantage of Western sympathy for Tel Aviv following Iran’s highly telegraphed attack,” said HA Hellyer, an authority on Middle East security at the Carnegie Endowment for International Peace and the Royal United Services Institute.
In the months leading up to October, popular discontent with Netanyahu was growing after his extreme right-wing government attempted to force through changes that would hobble Israel’s independent judiciary.
In the months since October 7, protests have been growing against his handling of the war on Gaza as he is perceived to be less than interested in securing the release of the remaining captives taken from Israel in the attack.
The protests, in addition to swelling, have developed into demonstrations against him and his rule.

 
Even the US seemed to have lost patience with Netanyahu, with a highly publicised invitation issued to Benny Gantz, a member of Israel’s war cabinet, to visit Washington, DC for talks.
Netanyahu has worked to regain lost ground, using every opportunity to position himself at the forefront of a surge of nationalism that makes many people in Israel reluctant to call for an end to the war.
‘A tipping point’
However, irrespective of how Israel chooses to portray itself in this latest clash, it is the US staging the play.
“What we have heard so far is that the US has no interest in a war and are signalling that there will be a unified diplomatic response to Iran from the West, while at the same time calling for restraint,” Azizi said.
With the US’s signalling, Netanyahu’s gambit looks in jeopardy.
“We are at a tipping point and the only solution is diplomatic,” Bar-Yaacov said. “A harsh military response risks dragging the region into further turmoil.”
Diplomatically, Israel’s response to the attack has mirrored that of its reaction to the earlier one, with its ambassador to the United Nations calling for a UN Security Council meeting on the matter, once again trying to marshall international opinion behind Israel, despite this latest strike being a response to Israel’s own.
Moreover, with Iran looking less likely to suffer any cost for its strike upon Israel, he risks widening the divisions in both his own cabinet and in Israeli society if no action is taken.
“If [Netanyahu] thinks DC will reject backing an assault on Iran itself, then attacks on scores of proxies simultaneously could be an alternative option,” Hellyer said.

Source: Al Jazeeraaj-logoaj-logoaj-logoAboutShow moreAbout UsCode of EthicsTerms and ConditionsEU/EEA Regulatory NoticePrivacy PolicyCookie PolicyCookie PreferencesSitemapWork for usHR QualityConnectShow moreContact UsUser Accounts HelpAdvertise with usAppsNewslettersChannel FinderTV SchedulePodcastsSubmit a TipOur ChannelsShow moreAl Jazeera ArabicAl Jazeera EnglishAl Jazeera Investigative UnitAl Jazeera MubasherAl Jazeera DocumentaryAl Jazeera BalkansAJ+Our NetworkShow moreAl Jazeera Centre for StudiesAl Jazeera Media InstituteLearn ArabicAl Jazeera Centre for Public Liberties & Human RightsAl Jazeera ForumAl Jazeera Hotel PartnersFollow Al Jazeera English:facebooktwitteryoutubeinstagram-colored-outlinerss© 2024 Al Jazeera Media Network

"
